Brand,Prouduct Name,Price,Expected Delivary,Availibilty,Img Url
DEVICE OF URBAN INFOTECH,DEVICE OF URBAN INFOTECH 41 inch Acoustic Guitar for Beginners Adults Premium Wood Sunburst Curved Cutaway Design Acoustic Guitar Kit with Carry Bag Guitar for Adults Starters,"5,156","Saturday, 2 September",In stock,https://www.amazon.in/DEVICE-URBAN-INFOTECH-Acoustic-Beginners/dp/B0C6DVVVCC/ref=sr_1_175?keywords=guitar&qid=1693255591&sr=8-175
Kadence,"Kadence Acoustica Series, Semi Acoustic Guitar Spruce Top","7,999","Saturday, 2 September",In stock,https://www.amazon.in/Kadence-Acoustica-Acoustic-Guitar-Spruce/dp/B08L7XW5SR/ref=sr_1_176?keywords=guitar&qid=1693255591&sr=8-176
Cort,Cort AF510E Semi-Acoustic Guitar - Black,"12,559","Friday, 1 September",Only 1 left in stock,https://www.amazon.in/Cort-AF510E-Semi-Acoustic-Guitar-Black/dp/B00L5F93DE/ref=sr_1_177?keywords=guitar&qid=1693255591&sr=8-177
VAULT,Vault PA36 Parlor Body Compact Acoustic Guitar with Standard Scale Length Natural,"7,124","Thursday, 31 August",In stock,https://www.amazon.in/Parlor-Compact-Acoustic-Guitar-Standard/dp/B0BJK1332J/ref=sr_1_178?keywords=guitar&qid=1693255591&sr=8-178
Fender,Fender Acoustic Guitar Dreadnought Solid CD60S Mahogany 970110022,"18,091","Thursday, 31 August",In stock,https://www.amazon.in/Fender-CD-60S-Dreadnought-Acoustic-Guitar/dp/B07FYBLG93/ref=sr_1_179?keywords=guitar&qid=1693255591&sr=8-179
-,Kadence 12 strings Slowhand Premium Black Spruce wood Semi Acoustic Guitar KSH04-12EQ,"12,999","Saturday, 2 September",In stock,https://www.amazon.in/Kadence-strings-Slowhand-Acoustic-KSH04-12EQ/dp/B0CGDG462X/ref=sr_1_180?keywords=guitar&qid=1693255591&sr=8-180
VAULT,Vault LP1 Les Paul Style Electric Guitar - Tobacco Sunburst,"11,199","Thursday, 31 August",In stock,https://www.amazon.in/Vault-LP1MN-Style-Electric-Guitar/dp/B06VVSDM5K/ref=sr_1_181?keywords=guitar&qid=1693255591&sr=8-181
YAMAHA,"Yamaha APX600 NA Thin Body Acoustic-Electric Guitar, Natural","27,979",9 - 12 September,Only 1 left in stock,https://www.amazon.in/Yamaha-APX600-NA-Acoustic-Electric-Natural/dp/B078WYGGHS/ref=sr_1_182?keywords=guitar&qid=1693255591&sr=8-182
YAMAHA,"Yamaha FG 800 Folk Acoustic Guitar, Natural","19,990",8 - 11 September,Only 2 left in stock,https://www.amazon.in/Yamaha-Folk-Acoustic-Guitar-Natural/dp/B01C92QHLC/ref=sr_1_183?keywords=guitar&qid=1693255591&sr=8-183
JUAREZ,"JUAREZ Arpeggio Guitar JRA39SR-BL-K, blue","7,108","Thursday, 31 August",In stock,https://www.amazon.in/JUAREZ-Arpeggio-Guitar-JRA39SR-BL-K-blue/dp/B08MWB5Y67/ref=sr_1_184?keywords=guitar&qid=1693255591&sr=8-184
JUAREZ,"JUAREZ Arpeggio 39 Inch Acoustic Guitar Kit, Spruce Top, Rosewood Fretboard & Bridge, Truss Rod, Chrome Die Cast Machine Tuners, Red","5,979","Thursday, 31 August",In stock,https://www.amazon.in/JUAREZ-Arpeggio-Acoustic-Rosewood-Fretboard/dp/B08LBJ8PTM/ref=sr_1_185?keywords=guitar&qid=1693255591&sr=8-185
YAMAHA,Yamaha FSX80C Semi acoustic cutaway guitar (natural),"12,704","Saturday, 2 September",In stock,https://www.amazon.in/Yamaha-FSX80C-Acoustic-Cutaway-Natural/dp/B09HL3GFZF/ref=sr_1_186?keywords=guitar&qid=1693255591&sr=8-186
Kadence,"Kadence Astro Man Electric Guitar, with Free learning course 24 FRETS, H- S - S PICK UPS Walnut Top with Alder wood Back and Sides (white) With Amplifier","9,999","Thursday, 31 August",In stock,https://www.amazon.in/Kadence-Astro-Electric-Guitar-FRETS/dp/B09YHPH1MZ/ref=sr_1_187?keywords=guitar&qid=1693255591&sr=8-187
Cort,"Cort SFX-MEM Electro Acoustic Guitar - Open Pore, Mahogany, SFXMEMOP (SFXMEMOP)","15,884","Thursday, 31 August",Only 1 left in stock,https://www.amazon.in/Cort-SFX-MEM-Electro-Acoustic-Guitar/dp/B0915ZCZWK/ref=sr_1_188?keywords=guitar&qid=1693255591&sr=8-188
JUAREZ,"JUAREZ Arpeggio 99.06 cm (39 Inch) Acoustic Guitar Kit, Spruce Top, Rosewood Fretboard & Bridge, Truss Rod, Chrome Die Cast Machine Tuners, Black","5,979","Thursday, 31 August",In stock,https://www.amazon.in/JUAREZ-Arpeggio-Acoustic-Rosewood-Fretboard/dp/B08LBHB547/ref=sr_1_189?keywords=guitar&qid=1693255591&sr=8-189
VAULT,Vault JB4 Jazz Bass 4-String Bass Guitar - Black,"9,999","Thursday, 31 August",In stock,https://www.amazon.in/Vault-Jazz-Bass-4-String-Guitar/dp/B09ZXGM7C3/ref=sr_1_190?keywords=guitar&qid=1693255591&sr=8-190
blueberry,"Blueberry, VIP-361, 36Inch Acoustic Guitar Kit With Bag, Belt, String Set And 2 Picks Natural","3,290","Monday, 4 September",In stock,https://www.amazon.in/sspa/click?ie=UTF8&spc=MTo2MDE0NjEyOTM5NTM2NjA0OjE2OTMyNTU1OTE6c3BfYnRmOjIwMTI3OTkwMDI4ODk4OjowOjo&url=%2FBlueberry-VIP-361-36Inch-Acoustic-Natural%2Fdp%2FB0BVVKLLJN%2Fref%3Dsr_1_191_sspa%3Fkeywords%3Dguitar%26qid%3D1693255591%26sr%3D8-191-spons%26sp_csd%3Dd2lkZ2V0TmFtZT1zcF9idGY%26psc%3D1
blueberry,"Blueberry B-D38, 38"" Acoustic Guitar Kit Inbuilt Truss Rod, with Bag, Strap, One Pack Strings And Picks (MAROON BROWN)","2,895","Monday, 4 September",In stock,https://www.amazon.in/sspa/click?ie=UTF8&spc=MTo2MDE0NjEyOTM5NTM2NjA0OjE2OTMyNTU1OTE6c3BfYnRmOjIwMDc4MzM2ODg1MDk4OjowOjo&url=%2FBlueberry-B-D38-Acoustic-Inbuilt-Strings%2Fdp%2FB0B74CSY9V%2Fref%3Dsr_1_192_sspa%3Fkeywords%3Dguitar%26qid%3D1693255591%26sr%3D8-192-spons%26sp_csd%3Dd2lkZ2V0TmFtZT1zcF9idGY%26psc%3D1
blueberry,"Blueberry, VIP-384, 38Inch Cutaway Acoustic Guitar Kit With Bag, Belt, String Set And 2 Picks Natural","3,290","Monday, 4 September",In stock,https://www.amazon.in/sspa/click?ie=UTF8&spc=MTo2MDE0NjEyOTM5NTM2NjA0OjE2OTMyNTU1OTE6c3BfYnRmOjIwMTI3OTkwMDI4MTk4OjowOjo&url=%2FBlueberry-VIP-384-Cutaway-Acoustic-Natural%2Fdp%2FB0BVW5TLPN%2Fref%3Dsr_1_193_sspa%3Fkeywords%3Dguitar%26qid%3D1693255591%26sr%3D8-193-spons%26sp_csd%3Dd2lkZ2V0TmFtZT1zcF9idGY%26psc%3D1
blueberry,"Blueberry B-G41S, 41 Inch Acoustic Guitar Kit Inbuilt Truss Rod, with Bag,Belt, One Pack Strings And Picks (Brown) (Natural brown)","6,500","Monday, 4 September",Only 1 left in stock,https://www.amazon.in/sspa/click?ie=UTF8&spc=MTo2MDE0NjEyOTM5NTM2NjA0OjE2OTMyNTU1OTE6c3BfYnRmOjIwMDc4MzM2ODg5NDk4OjowOjo&url=%2FBlueberry-B-G41S-Acoustic-Inbuilt-Strings%2Fdp%2FB07PKQGC3D%2Fref%3Dsr_1_194_sspa%3Fkeywords%3Dguitar%26qid%3D1693255591%26sr%3D8-194-spons%26sp_csd%3Dd2lkZ2V0TmFtZT1zcF9idGY%26psc%3D1
