Brand,Prouduct Name,Price,Expected Delivary,Availibilty,Img Url
Kadence,Kadence Concert Sized Ukulele 24inch (Built in Equalizer) With Bag and Tuner (Saple Wood With Binding),"3,999","Thursday, 31 August",In stock,https://www.amazon.in/Kadence-Concert-Ukulele-Equalizer-Binding/dp/B08PNSGQBL/ref=sr_1_115?keywords=guitar&qid=1693255586&sr=8-115
Kadence,"Kadence Frontier Series Semi Acoustic Guitar With Die Cast Keys Natural Super Combo, Capo, Bag, strap, strings and 3 picks)","5,999","Saturday, 2 September",In stock,https://www.amazon.in/Kadence-Frontier-Acoustic-Equalizer-Foldable/dp/B01I50UMPO/ref=sr_1_116?keywords=guitar&qid=1693255586&sr=8-116
blueberry,"Blueberry B-38, 38"" Acoustic Guitar Kit Inbuilt Truss Rod with Bag, Strap, One Pack Strings And Picks (Natural)","2,655","Monday, 4 September",In stock,https://www.amazon.in/sspa/click?ie=UTF8&spc=MToxNDQ2MjA1MjAwODY3NjA0OjE2OTMyNTU1ODY6c3BfbXRmOjIwMDc4MzM2ODg4Nzk4OjowOjo&url=%2FBlueberry-B-D38-Acoustic-inbuilt-Strings%2Fdp%2FB07PCRZ1CD%2Fref%3Dsr_1_117_sspa%3Fkeywords%3Dguitar%26qid%3D1693255586%26sr%3D8-117-spons%26sp_csd%3Dd2lkZ2V0TmFtZT1zcF9tdGY%26psc%3D1
blueberry,"Blueberry B40L, 40"" Acoustic Guitar Kit Inbuilt Truss Rod with Bag, Strap, One Pack Strings And Picks (Classic Maroon)","4,290","Monday, 4 September",In stock,https://www.amazon.in/sspa/click?ie=UTF8&spc=MToxNDQ2MjA1MjAwODY3NjA0OjE2OTMyNTU1ODY6c3BfbXRmOjIwMDc4MzM2ODg1MTk4OjowOjo&url=%2FBlueberry-Acoustic-Inbuilt-Strings-Classic%2Fdp%2FB09VLF8B8G%2Fref%3Dsr_1_118_sspa%3Fkeywords%3Dguitar%26qid%3D1693255586%26sr%3D8-118-spons%26sp_csd%3Dd2lkZ2V0TmFtZT1zcF9tdGY%26psc%3D1
Multi colour,Right Search ®Musical Guitar and Drum Combo Set_GD2,"1,099","Saturday, 2 September",In stock,https://www.amazon.in/sspa/click?ie=UTF8&spc=MToxNDQ2MjA1MjAwODY3NjA0OjE2OTMyNTU1ODY6c3BfbXRmOjMwMDAwODgyMTczODAzMjo6MDo6&url=%2FRight-Search-%25C2%25AEMusical-Guitar-Set_GD2%2Fdp%2FB09PYFV844%2Fref%3Dsr_1_119_sspa%3Fkeywords%3Dguitar%26qid%3D1693255586%26sr%3D8-119-spons%26sp_csd%3Dd2lkZ2V0TmFtZT1zcF9tdGY%26psc%3D1
blueberry,"Blueberry, VlP-405, 40Inch TrussRod Acoustic Guitar With Bag, Belt, String Set And 2 Picks (Classic Brown)","4,590","Monday, 4 September",Only 2 left in stock,https://www.amazon.in/sspa/click?ie=UTF8&spc=MToxNDQ2MjA1MjAwODY3NjA0OjE2OTMyNTU1ODY6c3BfbXRmOjIwMTI3OTkwMDI5MTk4OjowOjo&url=%2FBlueberry-VlP-405-TrussRod-Acoustic-Classic%2Fdp%2FB0BVZBL1VJ%2Fref%3Dsr_1_120_sspa%3Fkeywords%3Dguitar%26qid%3D1693255586%26sr%3D8-120-spons%26sp_csd%3Dd2lkZ2V0TmFtZT1zcF9tdGY%26psc%3D1
Generic,Acoustic Guitar,"1,999","Tuesday, 5 September",In stock,https://www.amazon.in/Generic-G001-Acoustic-Guitar/dp/B0CCKRBHF6/ref=sr_1_121?keywords=guitar&qid=1693255586&sr=8-121
blueberry,"Blueberry B-40, 40"" Acoustic Guitar Kit Inbuilt Truss Rod, with Bag,Belt, One Pack Strings And Picks (Black)","4,290","Monday, 4 September",In stock,https://www.amazon.in/Blueberry-B-40Y-Acoustic-Inbuilt-Strings/dp/B07PLK112T/ref=sr_1_122?keywords=guitar&qid=1693255586&sr=8-122
YAMAHA,Yamaha FSX80C Semi acoustic cutaway guitar (Black),"11,990",Add a Protection Plan:,In stock,https://www.amazon.in/Yamaha-FSX80C-Acoustic-Cutaway-Guitar/dp/B09HL5WFDX/ref=sr_1_123?keywords=guitar&qid=1693255586&sr=8-123
Ibanez,"Ibanez MD39C Cutaway Acoustic Guitar - Sunburst, MD-39CDB (IBA-MD39CSB)","7,929","Friday, 1 September",Only 2 left in stock,https://www.amazon.in/Ibanez-MD39C-NT-Cutaway-Acoustic-MD39CSB/dp/B07KYKTRKX/ref=sr_1_124?keywords=guitar&qid=1693255586&sr=8-124
GIVSON,"Givson Venus Special Cutaway Rosewood 41 Inch Acoustic Guitar Kit With Cover/Bag, String Set, Strap and 5 Plectrums (BLACK)","4,299","Saturday, 2 September",In stock,https://www.amazon.in/Givson-Ketostics-Guitar-Acoustic-Plectrums/dp/B08KS5MRSC/ref=sr_1_125?keywords=guitar&qid=1693255586&sr=8-125
SAGA,Saga SF-600C-NAT Dreadnought Cutaway Acoustic Guitar (Natural),"8,235","Saturday, 2 September",In stock,https://www.amazon.in/SF-600C-NAT-Dreadnought-Cutaway-Acoustic-Natural/dp/B0B1HX47XR/ref=sr_1_126?keywords=guitar&qid=1693255586&sr=8-126
Fender,"Fender 0930307021 SA-105CE Dreadnought Cutaway Electric Guitar - Natural, full size","12,491","Thursday, 31 August",Only 1 left in stock,https://www.amazon.in/Fender-0930307021-SA-105CE-Dreadnought-Electric/dp/B009X3PLRC/ref=sr_1_127?keywords=guitar&qid=1693255586&sr=8-127
Fender,Fender Acoustic Guitar Dreadnought Cutaway Electronics FA-125CE Natural Right-Hand 0971113221 One of The Most reputed Guitar Brands in the World,"18,659","Thursday, 31 August",In stock,https://www.amazon.in/Fender-FA-125CE-Dreadnought-Fingerboard-Natural/dp/B07R16NMKH/ref=sr_1_128?keywords=guitar&qid=1693255586&sr=8-128
blueberry,"Blueberry, VIP-301, 30Inch Acoustic Guitar Kit With Bag, Belt, String Sets And 2 Picks Natural","3,290","Monday, 4 September",In stock,https://www.amazon.in/Blueberry-VIP-301-30Inch-Acoustic-Natural/dp/B0BVVFNXMD/ref=sr_1_129?keywords=guitar&qid=1693255586&sr=8-129
HOVNER,"Hovner Carlton Special Quality Rosewood Fretboard Blue Semi Acoustic Guitar With Bag,Strap,1 Set of Extra Strings and 2 Picks By K-Retail (Blue)","4,635","Saturday, 2 September",In stock,https://www.amazon.in/Carlton-Rosewood-Fretboard-Acoustic-K-Retail/dp/B07KK8P9VB/ref=sr_1_130?keywords=guitar&qid=1693255586&sr=8-130
Ibanez,"Ibanez GRG170DX 40 Inches Wood Electric Guitar, Black","23,339","Thursday, 31 August",In stock,https://www.amazon.in/Ibanez-GRG170DX-Electric-Guitar-Black/dp/B001EM180O/ref=sr_1_131?keywords=guitar&qid=1693255586&sr=8-131
Cort,Cort Acoustic Guitar Pack CAP-810 Open Pore,"9,492","Friday, 1 September",In stock,https://www.amazon.in/Cort-CAP810-OP-Acoustic-Plectrums-Complete/dp/B08D7SWGG5/ref=sr_1_132?keywords=guitar&qid=1693255586&sr=8-132
JUAREZ,JUAREZ JRZ41C 41 Inch ACOUSTIC GUITAR WITH ACC (3TS SUNBURST),"4,169","Thursday, 31 August",In stock,https://www.amazon.in/JUAREZ-JRZ41C-ACOUSTIC-GUITAR-SUNBURST/dp/B07X1XQC4Z/ref=sr_1_133?keywords=guitar&qid=1693255586&sr=8-133
Ibanez,"Ibanez MD39C-NT 39 Inches Rose Wood Cutaway Acoustic Guitar With Gig-Bag, Polishing Cloth And E-Book","7,699","Thursday, 31 August",In stock,https://www.amazon.in/Ibanez-MD39C-NT-Cutaway-Acoustic-Polishing/dp/B084BQJCP8/ref=sr_1_134?keywords=guitar&qid=1693255586&sr=8-134
Fender,Fender Acoustic Guitar Concert Cutaway Electronics CC60SCE Black 970153006,"28,640","Friday, 1 September",Only 1 left in stock,https://www.amazon.in/Fender-CC-60SCE-Concert-Acoustic-Guitar/dp/B07K89DNTZ/ref=sr_1_135?keywords=guitar&qid=1693255586&sr=8-135
YAMAHA,"YAMAHA F310-TBS Right Handed Spruce, Back/Side/Rib, Meranti Acoustic Guitar (Tobacco Sunburst, 6-Strings)","10,490","Saturday, 2 September",Only 1 left in stock,https://www.amazon.in/Yamaha-6-String-Acoustic-Right-Handed-Sunburst/dp/B000WITGQO/ref=sr_1_136?keywords=guitar&qid=1693255586&sr=8-136
YAMAHA,"Yamaha Electric-Acoustic Guitar FX280 Dreadnought With Mexa Sponge Guitar Bag, Belt,Plectrums.","12,499","Sunday, 3 September",In stock,https://www.amazon.in/Yamaha-Electric-Acoustic-FX280-Dreadnought-Plectrums/dp/B09HSHNR6R/ref=sr_1_137?keywords=guitar&qid=1693255586&sr=8-137
blueberry,"Blueberry B-38C-Brown 38 Inch Acoustic Guitar Kit with Bag, Strap, One Pack Strings And 2 Picks","2,450","Monday, 4 September",In stock,https://www.amazon.in/Blueberry-B-38C-Brown-Acoustic-Guitar-Strings/dp/B0B71BHDGQ/ref=sr_1_138?keywords=guitar&qid=1693255586&sr=8-138
Cort,Cort AF510M-OP Acoustic Guitar,"9,800","Thursday, 31 August",In stock,https://www.amazon.in/Cort-AF510MOP-AF510M-OP-Acoustic-Guitar/dp/B00E3GQ9MK/ref=sr_1_139?keywords=guitar&qid=1693255586&sr=8-139
YAMAHA,Yamaha FX280 Tobacco Brown Sunburst Electro Acoustic Guitar,"11,190","Saturday, 2 September",Only 1 left in stock,https://www.amazon.in/FX280-acoustic-Dreadnought-Tobacco-Sunburst/dp/B09HR7BXGW/ref=sr_1_140?keywords=guitar&qid=1693255586&sr=8-140
YAMAHA,"Yamaha 16 Incheses wood Acoustic Guitar F280 Dreadnought With Mexa Sponge Bag Belt,Plectrums, String Set & Guitar StAnd (Natural)","8,999","Sunday, 3 September",In stock,https://www.amazon.in/Acoustic-F280-Dreadnought-Plectrums-Natural/dp/B092TPXZRN/ref=sr_1_141?keywords=guitar&qid=1693255586&sr=8-141
Kadence,"Kadence Frontier Jumbo Semi Acoustic Guitar, (Bag, 1 pack Strings, Strap, Picks, (Natural EQ C)","6,899","Saturday, 2 September",In stock,https://www.amazon.in/Kadence-Frontier-Acoustic-Equalizer-Natural/dp/B01HRIOSGE/ref=sr_1_142?keywords=guitar&qid=1693255586&sr=8-142
AUREUS,AUREUS 4 String Acoustic Guitar Musical Instrument Educational Small Guitar for Beginners Kids Children,999,"Saturday, 2 September",In stock,https://www.amazon.in/AUREUS-Acoustic-Instrument-Educational-Beginners/dp/B09W12QFQD/ref=sr_1_143?keywords=guitar&qid=1693255586&sr=8-143
Kadence,Kadence Acoustica Series Semi Acoustic Ash Wood with Fluorocarbon strings Equalizer A-06 (Ukulele),"3,299","Saturday, 2 September",In stock,https://www.amazon.in/Kadence-Acoustica-Acoustic-Fluorocarbon-Equalizer/dp/B08PBLKL62/ref=sr_1_144?keywords=guitar&qid=1693255586&sr=8-144
Medellin,"Medellin M38 carbon fiber body 38 Incheses Acoustic Guitar (White) Durable Matt finish With hAndrest, strings, strap, bag, 3 Picks, capo, stAnd","2,499",,,https://www.amazon.in/Medellin-Acoustic-Guitar-Carbon-Learning/dp/B09MSFP7JK/ref=sr_1_145?keywords=guitar&qid=1693255586&sr=8-145
YAMAHA,"Yamaha F280 Acoustic sprucewood Guitar Dreadnought With Mexa Guitar Bag, Belt, String Set, Plectrums & Guitar StAnd (Tsb)","8,699","Sunday, 3 September",In stock,https://www.amazon.in/Yamaha-F280-Acoustic-Dreadnought-Plectrum/dp/B08VN2V5V3/ref=sr_1_146?keywords=guitar&qid=1693255586&sr=8-146
VAULT,Vault ST1 Premium Electric Guitar - White,"7,999","Thursday, 31 August",In stock,https://www.amazon.in/Vault-ST1-Premium-Electric-Guitar/dp/B09GLYSJ8W/ref=sr_1_147?keywords=guitar&qid=1693255586&sr=8-147
Kadence,Kadence GenZ Guitar (with Guitar learning course) Acoustic Guitar with Die Cast Keys and Bag (Pink),"5,999","Friday, 1 September",In stock,https://www.amazon.in/Kadence-Guitar-learning-course-Acoustic/dp/B0CD4C26LD/ref=sr_1_148?keywords=guitar&qid=1693255586&sr=8-148
Kordz,"Kordz Luana Blue 41 Inch Rosewood Fretboard Acoustic Guitar With Bag,Strap,1 Set of Extra Strings and 2 Picks","3,890","Saturday, 2 September",In stock,https://www.amazon.in/Kordz-Luana-Rosewood-Fretboard-Acoustic/dp/B09FFM9VSH/ref=sr_1_149?keywords=guitar&qid=1693255586&sr=8-149
Intern,"Intern INT-38C-L-SB Left Hand Acoustic Guitar Kit, With Bag, Strings, Pick And Strap (Sunburst)","2,799","Thursday, 31 August",In stock,https://www.amazon.in/Intern-INT-38C-L-SB-Acoustic-Guitar-Sunburst/dp/B07J5B69MB/ref=sr_1_150?keywords=guitar&qid=1693255586&sr=8-150
blueberry,"Blueberry, VlP-405, 40Inch TrussRod Acoustic Guitar With Bag, Belt, String Set And 2 Picks (Classic Brown)","4,590","Monday, 4 September",Only 2 left in stock,https://www.amazon.in/Blueberry-VlP-405-TrussRod-Acoustic-Classic/dp/B0BVZBL1VJ/ref=sr_1_151?keywords=guitar&qid=1693255586&sr=8-151
Tanglewood,"Tanglewood Discovery Exotic DBT TCE BW Electro-Acoustic Travel Guitar, with Bag, FISHMAN Pickup, Free Natural","21,567","Saturday, 2 September",Only 1 left in stock,https://www.amazon.in/Tanglewood-DBT-TCE-BW-Electro-Acoustic/dp/B085CNHPVH/ref=sr_1_152?keywords=guitar&qid=1693255586&sr=8-152
Multi colour,Right Search ® Musical Guitar Toy_g1,299,"Saturday, 2 September",In stock,https://www.amazon.in/sspa/click?ie=UTF8&spc=MToxNDQ2MjA1MjAwODY3NjA0OjE2OTMyNTU1ODY6c3BfYnRmOjMwMDAwODg4MjMwNzMzMjo6MDo6&url=%2FRight-Search-Musical-Guitar-Toy_g1%2Fdp%2FB09Z9CQZQ9%2Fref%3Dsr_1_153_sspa%3Fkeywords%3Dguitar%26qid%3D1693255586%26sr%3D8-153-spons%26sp_csd%3Dd2lkZ2V0TmFtZT1zcF9idGY%26psc%3D1
Guitar Bro,"GUITAR BRO - COMBO (Black Acoustic Rose Wood Guitar for Beginner, Guitar Learning Kit, Song Book, Video Lectures, Accessories like Pick, Bag)","8,999",6 - 8 September,In stock,https://www.amazon.in/sspa/click?ie=UTF8&spc=MToxNDQ2MjA1MjAwODY3NjA0OjE2OTMyNTU1ODY6c3BfYnRmOjIwMDQ5MTI5MTM2MjAxOjowOjo&url=%2FGUITAR-BRO-Acoustic-Beginner-Accessories%2Fdp%2FB07T84GC8L%2Fref%3Dsr_1_154_sspa%3Fkeywords%3Dguitar%26qid%3D1693255586%26sr%3D8-154-spons%26sp_csd%3Dd2lkZ2V0TmFtZT1zcF9idGY%26psc%3D1
blueberry,"Blueberry 38 Inch D38S Acoustic Guitar Kit Inbuilt Truss Rod, with Bag, Belt, One Pack Strings And Picks (Brown)","2,999","Monday, 4 September",In stock,https://www.amazon.in/sspa/click?ie=UTF8&spc=MToxNDQ2MjA1MjAwODY3NjA0OjE2OTMyNTU1ODY6c3BfYnRmOjIwMDc4MzM2ODg5Mzk4OjowOjo&url=%2FBlueberry-Acoustic-Guitar-Inbuilt-Strings%2Fdp%2FB07PHZ16BG%2Fref%3Dsr_1_155_sspa%3Fkeywords%3Dguitar%26qid%3D1693255586%26sr%3D8-155-spons%26sp_csd%3Dd2lkZ2V0TmFtZT1zcF9idGY%26psc%3D1
VAULT,"Vault Traveller 34 Inch Acoustic Guitar With Truss Rod, Gig-Bag, Strap, Strings, Polishing Cloth, String Winder, Picks & E-Book - Natural Gloss","4,084","Thursday, 31 August",In stock,https://www.amazon.in/sspa/click?ie=UTF8&spc=MToxNDQ2MjA1MjAwODY3NjA0OjE2OTMyNTU1ODY6c3BfYnRmOjIwMDM2MjQ0NTU5NTk4OjowOjo&url=%2FTraveller-Acoustic-Guitar-Strings-Polishing%2Fdp%2FB07RK9962M%2Fref%3Dsr_1_156_sspa%3Fkeywords%3Dguitar%26qid%3D1693255586%26sr%3D8-156-spons%26sp_csd%3Dd2lkZ2V0TmFtZT1zcF9idGY%26psc%3D1
Kadence,"Kadence Frontier Semi Acoustic Guitar 40"" with Learning Course, Die cast keys with Combo (Bag,strap,strings And 3 picks) (Black, Electric Acoustic)","4,999","Friday, 1 September",In stock,https://www.amazon.in/sspa/click?ie=UTF8&spc=MTo2MDE0NjEyOTM5NTM2NjA0OjE2OTMyNTU1OTE6c3BfYXRmX25leHQ6MjAxNTIyMzM2OTAzOTg6OjA6Og&url=%2FKadence-Frontier-Acoustic-Wihtout-strings%2Fdp%2FB08PKG3SY8%2Fref%3Dsr_1_145_sspa%3Fkeywords%3Dguitar%26qid%3D1693255591%26sr%3D8-145-spons%26sp_csd%3Dd2lkZ2V0TmFtZT1zcF9hdGZfbmV4dA%26psc%3D1
FESTRA,"Festra R-40-Natural Acoustic Guitar Kit with Bag, Strap, One Pack Strings And 2 Picks","4,076","Monday, 4 September",In stock,https://www.amazon.in/sspa/click?ie=UTF8&spc=MTo2MDE0NjEyOTM5NTM2NjA0OjE2OTMyNTU1OTE6c3BfYXRmX25leHQ6MjAwNzgzMzY4ODU5OTg6OjA6Og&url=%2FFestra-R-40-Natural-Acoustic-Guitar-Strings%2Fdp%2FB09VL5DX17%2Fref%3Dsr_1_146_sspa%3Fkeywords%3Dguitar%26qid%3D1693255591%26sr%3D8-146-spons%26sp_csd%3Dd2lkZ2V0TmFtZT1zcF9hdGZfbmV4dA%26psc%3D1
-,Mustang Guitar Stand Foldable Universal A-Frame Style Guitar Stand Black For Acoustic Electric Guitars,398,"Saturday, 2 September",In stock,https://www.amazon.in/sspa/click?ie=UTF8&spc=MTo2MDE0NjEyOTM5NTM2NjA0OjE2OTMyNTU1OTE6c3BfYXRmX25leHQ6MjAwNjAzNTI5MTUxOTg6OjA6Og&url=%2FMustang-Foldable-Universal-Acoustic-Electric%2Fdp%2FB077P4KG9Q%2Fref%3Dsr_1_147_sspa%3Fkeywords%3Dguitar%26qid%3D1693255591%26sr%3D8-147-spons%26sp_csd%3Dd2lkZ2V0TmFtZT1zcF9hdGZfbmV4dA%26psc%3D1
Gibz's guitar,"Gibz's Guitar FT-G41 Frontier Series 41"" Jumbo Semi Acoustic Guitar With Die Cast Keys, Super Combo (Bag, 1 pack Strings, Strap, Picks, Capo (Natural)","6,999","Friday, 1 September",In stock,https://www.amazon.in/sspa/click?ie=UTF8&spc=MTo2MDE0NjEyOTM5NTM2NjA0OjE2OTMyNTU1OTE6c3BfYXRmX25leHQ6MjAxNjA5NDE4MDg0OTg6OjA6Og&url=%2FGibzs-FT-G41-Frontier-Acoustic-Strings%2Fdp%2FB0BY5DBMVW%2Fref%3Dsr_1_148_sspa%3Fkeywords%3Dguitar%26qid%3D1693255591%26sr%3D8-148-spons%26sp_csd%3Dd2lkZ2V0TmFtZT1zcF9hdGZfbmV4dA%26psc%3D1
Tanglewood,"Tanglewood Discovery Exotic DBT TCE BW Electro-Acoustic Travel Guitar, with Bag, FISHMAN Pickup, Free Natural","21,567","Saturday, 2 September",Only 1 left in stock,https://www.amazon.in/Tanglewood-DBT-TCE-BW-Electro-Acoustic/dp/B085CNHPVH/ref=sr_1_149?keywords=guitar&qid=1693255591&sr=8-149
Kadence,"Kadence Guitar Frontier Series, Blue Acoustic Guitar with Die Cast Keys, Set of Strings, Strap, Picks, Guitar stand, Capo and Bag, Super Combo (Blue, Acoustic)","4,999","Saturday, 2 September",In stock,https://www.amazon.in/Kadence-Frontier-Acoustic-Foldable-Strings/dp/B01CJJGEVS/ref=sr_1_150?keywords=guitar&qid=1693255591&sr=8-150
STERLING GUITARS,Sterling by Music Man StingRay Guitar in in Daphne Blue (Model: SR30-DBL-R1),"34,927","Friday, 1 September",Only 2 left in stock,https://www.amazon.in/Sterling-Music-StingRay-Guitar-Daphne/dp/B0921HKSZ4/ref=sr_1_151?keywords=guitar&qid=1693255591&sr=8-151
YAMAHA,"Yamaha FS80C Acoustic Guitar Cutaway Concert Body With Mexa Sponge Bag, Guitar Belt, Guitar Stand, String Set & Plectrums.(BK)","9,790","Sunday, 3 September",In stock,https://www.amazon.in/FS80C-Acoustic-Cutaway-Concert-Plectrums/dp/B09HSHGD3B/ref=sr_1_152?keywords=guitar&qid=1693255591&sr=8-152
YAMAHA,"Yamaha Acoustic Guitar F310 Dreadnought With Mexa Guitar Bag, Head Cover, Belt, Plectrums & String Set.","11,889","Sunday, 3 September",Only 2 left in stock,https://www.amazon.in/Yamaha-Acoustic-Guitar-Dreadnought-Plectrums/dp/B094H8NGBM/ref=sr_1_153?keywords=guitar&qid=1693255591&sr=8-153
Fender,Fender SA 135C 39 Inch 6 String Cutaway Acoustic Guitar - Hardwood Fretboard - Natural (SA-135CNT Bundle),"8,199","Thursday, 31 August",In stock,https://www.amazon.in/Fender-String-Cutaway-Acoustic-Guitar/dp/B07ZJP1CM4/ref=sr_1_154?keywords=guitar&qid=1693255591&sr=8-154
Kadence,"Kadence AstroMan Electric Guitar, 21 FRETS, ROSEWOOD FRETBOARD, H - S - S PICK UPS Black combo with Bag, Guitar strap,guitar cable and Picks","7,999","Thursday, 31 August",In stock,https://www.amazon.in/Kadence-Electric-Guitar-Rosewood-Fretboard/dp/B07BGW6JVL/ref=sr_1_145?keywords=guitar&qid=1693255591&sr=8-145
Hertz,Hertz HZA4800 Acoustic Guitar Brown Shadow,"6,399",5 - 7 September,In stock,https://www.amazon.in/Hertz-HZA4800-Acoustic-Guitar-Shadow/dp/B0CDH9SYQY/ref=sr_1_146?keywords=guitar&qid=1693255591&sr=8-146
Fender,Fender Acoustic Guitar Concert Cutaway Electronics FA135CE 971253522 Mahogany,"20,499","Friday, 1 September",Only 1 left in stock,https://www.amazon.in/Fender-FA135CE-Concert-Acoustic-Guitar/dp/B07YX6MM9N/ref=sr_1_147?keywords=guitar&qid=1693255591&sr=8-147
YAMAHA,"Yamaha FS100C Acoustic Guitar, Natural","9,989","Thursday, 31 August",In stock,https://www.amazon.in/Yamaha-FS100C-Acoustic-Guitar-Natural/dp/B08Z3DVN8N/ref=sr_1_148?keywords=guitar&qid=1693255591&sr=8-148
Kadence,"Kadence Frontier Series 40 Incheses wood Semi Acoustic Guitar With Die Cast Keys (Bag,Strap,Strings And 3 Picks) (Sunburst)","5,499","Saturday, 2 September",In stock,https://www.amazon.in/Kadence-Frontier-Acoustic-Sunburst-Strings/dp/B07T5DMPZ3/ref=sr_1_149?keywords=guitar&qid=1693255591&sr=8-149
Cort,Cort AD810 Dreadnought Acoustic Guitar sunburst,"9,699","Thursday, 31 August",Only 1 left in stock,https://www.amazon.in/Cort-AD810-Dreadnought-Acoustic-Guitar/dp/B07G4CB8FQ/ref=sr_1_150?keywords=guitar&qid=1693255591&sr=8-150
JUAREZ,"JUAREZ Arpéggio 104.14 cm (41 Inch) Acoustic Guitar Kit, Spruce Top, Black","6,059","Thursday, 31 August",In stock,https://www.amazon.in/JUAREZ-Arp%C3%A9ggio-Acoustic-Guitar-Spruce/dp/B08KGCFXKP/ref=sr_1_151?keywords=guitar&qid=1693255591&sr=8-151
Cort,Cort GA-MEDX Electro Acoustic Guitar With Bag.(OP),"14,999","Friday, 1 September",Only 1 left in stock,https://www.amazon.in/Cort-GA-MEDX-Electro-Acoustic-Guitar/dp/B09Y3FVX6Y/ref=sr_1_152?keywords=guitar&qid=1693255591&sr=8-152
HOVNER,"Hovner 215 Royal Metallic Black F-Cut Rosewood Fretboard Acoustic Guitar With Bag,Strap,1 Set of Extra Strings and 2 Picks","4,580","Saturday, 2 September",Only 1 left in stock,https://www.amazon.in/Hovner-Royal-Metallic-Rosewood-Fretboard/dp/B09RG6ZMWL/ref=sr_1_153?keywords=guitar&qid=1693255591&sr=8-153
VAULT,Vault CL-20 4/4 size Classical Guitar With Bag,"4,799","Thursday, 31 August",In stock,https://www.amazon.in/Vault-CL-20-size-Classical-Guitar/dp/B097NB12H3/ref=sr_1_154?keywords=guitar&qid=1693255591&sr=8-154
Multi colour,Right Search ® Musical Guitar Toy_g2,299,"Saturday, 2 September",In stock,https://www.amazon.in/sspa/click?ie=UTF8&spc=MTo2MDE0NjEyOTM5NTM2NjA0OjE2OTMyNTU1OTE6c3BfbXRmOjMwMDAwODg4MjMwNzIzMjo6MDo6&url=%2FRight-Search-Musical-Guitar-Toy_g2%2Fdp%2FB09Z9DP9NR%2Fref%3Dsr_1_155_sspa%3Fkeywords%3Dguitar%26qid%3D1693255591%26sr%3D8-155-spons%26sp_csd%3Dd2lkZ2V0TmFtZT1zcF9tdGY%26psc%3D1
blueberry,"Blueberry B40L, 40"" Acoustic Guitar Kit Inbuilt Truss Rod with Bag, Strap, One Pack Strings And Picks (Blueburst)","4,290","Monday, 4 September",In stock,https://www.amazon.in/sspa/click?ie=UTF8&spc=MTo2MDE0NjEyOTM5NTM2NjA0OjE2OTMyNTU1OTE6c3BfbXRmOjIwMDc4MzM2ODg4OTk4OjowOjo&url=%2FBlueberry-Acoustic-Guitar-Inbuilt-Strings%2Fdp%2FB07XBS8QQW%2Fref%3Dsr_1_156_sspa%3Fkeywords%3Dguitar%26qid%3D1693255591%26sr%3D8-156-spons%26sp_csd%3Dd2lkZ2V0TmFtZT1zcF9tdGY%26psc%3D1
IMAGINEA,Imaginea® 40 inch Acoustic Guitar for Beginner Electric Guitar Premium Wood Curved Cutaway Design Acoustic Guitar with Carry Bag Accessories Melody Maestro Guitar an Incredible Guitar for music,"5,499","Saturday, 2 September",In stock,https://www.amazon.in/sspa/click?ie=UTF8&spc=MTo2MDE0NjEyOTM5NTM2NjA0OjE2OTMyNTU1OTE6c3BfbXRmOjMwMDAzMTMwMTY1MjczMjo6MDo6&url=%2FImaginea%25C2%25AE-Acoustic-Beginner-Accessories-Incredible%2Fdp%2FB0CDS6Q6CF%2Fref%3Dsr_1_157_sspa%3Fkeywords%3Dguitar%26qid%3D1693255591%26sr%3D8-157-spons%26sp_csd%3Dd2lkZ2V0TmFtZT1zcF9tdGY%26psc%3D1
blueberry,"Blueberry, VIP-301, 30Inch Acoustic Guitar Kit With Bag, Belt, String Sets And 2 Picks Natural","3,290","Monday, 4 September",In stock,https://www.amazon.in/sspa/click?ie=UTF8&spc=MTo2MDE0NjEyOTM5NTM2NjA0OjE2OTMyNTU1OTE6c3BfbXRmOjIwMTI3OTkwMDI4OTk4OjowOjo&url=%2FBlueberry-VIP-301-30Inch-Acoustic-Natural%2Fdp%2FB0BVVFNXMD%2Fref%3Dsr_1_158_sspa%3Fkeywords%3Dguitar%26qid%3D1693255591%26sr%3D8-158-spons%26sp_csd%3Dd2lkZ2V0TmFtZT1zcF9tdGY%26psc%3D1
DEVICE OF URBAN INFOTECH,DEVICE OF URBAN INFOTECH 40 inch Acoustic Guitar for Beginners Adults Premium Wood Curved Cutaway Design Acoustic Guitar Kit with Carrying Gig Bag Guitar for Adults Starters Students (Beige),"5,449","Saturday, 2 September",In stock,https://www.amazon.in/DEVICE-URBAN-INFOTECH-Acoustic-Beginners/dp/B0CDS672C5/ref=sr_1_159?keywords=guitar&qid=1693255591&sr=8-159
Kadence,Kadence Acoustic guitar left hand guitar Black,"6,999","Saturday, 2 September",In stock,https://www.amazon.in/Kadence-Acoustica-Mahagony-Handed-Acoustic/dp/B07GS7N6TG/ref=sr_1_160?keywords=guitar&qid=1693255591&sr=8-160
JUAREZ,"Juarez 41 Inch Acoustic Guitar Kit with Truss Rod, Solid Linden Wood, Ziko Strings, Pearl Rosette, Rosewood Fretboard & Bridge, Die Cast Machine with Picks, Strap, Strings & Bag, High Gloss Black","3,989","Thursday, 31 August",In stock,https://www.amazon.in/Acoustic-Strings-Rosette-Rosewood-Fretboard/dp/B09FPQX7RN/ref=sr_1_161?keywords=guitar&qid=1693255591&sr=8-161
VAULT,Vault ST1 Premium Electric Guitar - Black,"7,999","Thursday, 31 August",In stock,https://www.amazon.in/Vault-ST1-Premium-Electric-Guitar/dp/B09GLZV36M/ref=sr_1_162?keywords=guitar&qid=1693255591&sr=8-162
VAULT,Vault Artisan Premium Acoustic Guitar with Solid Spruce Top and Solid Mahogany Back and Sides Natural,"23,274","Thursday, 31 August",In stock,https://www.amazon.in/Vault-Artisan-Premium-Acoustic-Guitar/dp/B09P179GCM/ref=sr_1_163?keywords=guitar&qid=1693255591&sr=8-163
Epiphone,"Epiphone SG Muse 6 String Right Handed Electric Guitar, Inspired by Gibson Series, Smoked Almond Metallic","35,441","Friday, 1 September",In stock,https://www.amazon.in/Epiphone-String-Electric-Inspired-Metallic/dp/B08BGCW2GB/ref=sr_1_164?keywords=guitar&qid=1693255591&sr=8-164
Epiphone,Epiphone Dove Pro Acoustic Electric Guitar,"43,900","Sunday, 3 September",Only 1 left in stock,https://www.amazon.in/Epiphone-EEDVVBNH1-Acoustic-Electric-Guitar/dp/B00ADVITGS/ref=sr_1_165?keywords=guitar&qid=1693255591&sr=8-165
Fender,"Fender 0971210521 (FA-125 Dreadnought w/bag, Walnut Fingerboard, Natural)","11,999","Thursday, 31 August",In stock,https://www.amazon.in/Fender-Alternative-String-Acoustic-971210521/dp/B07LD8RZVR/ref=sr_1_166?keywords=guitar&qid=1693255591&sr=8-166
Pluto,Pluto HW41C-201 Left Handed Acoustic Guitar Natural,"6,900","Thursday, 31 August",In stock,https://www.amazon.in/Pluto-HW41CL201NAT-HW41C-201-Acoustic-Guitar/dp/B099WQRRXV/ref=sr_1_167?keywords=guitar&qid=1693255591&sr=8-167
Kadence,"Kadence, Chronicle Series Electric Bass Guitar, Natural Ash Wood with P-J Pickup, 2 Tone and 2 Volume Control","12,999","Saturday, 2 September",In stock,https://www.amazon.in/Kadence-Chronicle-Electric-Natural-Control/dp/B071YF4P7D/ref=sr_1_168?keywords=guitar&qid=1693255591&sr=8-168
Fender,Fender Acoustic Guitar Dreadnought CD60 V3 Natural 970110521,"12,443","Thursday, 31 August",In stock,https://www.amazon.in/Fender-Dread-String-Acoustic-Guitar/dp/B07RL6VG3H/ref=sr_1_169?keywords=guitar&qid=1693255591&sr=8-169
YAMAHA,"Yamaha Electric-Acoustic Guitar FSX80C Dreadnought With With Mexa Guitar Bag, Guitar Belt, Guitar Stand, String Set & Plectrums.(NT)","13,790","Sunday, 3 September",In stock,https://www.amazon.in/Yamaha-Electric-Acoustic-FSX80C-Dreadnought-Plectrums/dp/B09HSJ6GPQ/ref=sr_1_170?keywords=guitar&qid=1693255591&sr=8-170
JUAREZ,"Juârez JRZ38C/ZEB 6 Strings Acoustic Guitar 38 Inch Cutaway, Right Handed, Zebrawood with Bag, Strings, Picks and Strap","2,949","Thursday, 31 August",In stock,https://www.amazon.in/Juarez-Strings-Acoustic-Cutaway-Zebrawood/dp/B072Q9L8DG/ref=sr_1_171?keywords=guitar&qid=1693255591&sr=8-171
ORANGEWOOD GUITARS,ORANGEWOOD GUITARS Rey-M Grand Auditorium Cutaway Layered Mahogany Top 41 Inches Acoustic Guitar,"15,469","Sunday, 3 September",In stock,https://www.amazon.in/Orangewood-Auditorium-Acoustic-Mahogany-Earthwood/dp/B07BN7JMX3/ref=sr_1_172?keywords=guitar&qid=1693255591&sr=8-172
Fender,Fender Acoustic Guitar Dreadnought Solid CD60S Natural 970110021,"17,500","Thursday, 31 August",In stock,https://www.amazon.in/Fender-60S-Dreadnought-Acoustic-Guitar/dp/B01MRA2W8L/ref=sr_1_173?keywords=guitar&qid=1693255591&sr=8-173
Fender,Fender Acoustic Guitar 3/4 Size FA-15 Matt Natural with Bag 971170135,"16,350","Friday, 1 September",Only 2 left in stock,https://www.amazon.in/Fender-0971170135-Acoustic-Guitar/dp/B08PJRGZ98/ref=sr_1_174?keywords=guitar&qid=1693255591&sr=8-174
